{
  "$schema": "../server.schema.json",
  "id": "intl",
  "packageName": "com.bilibili.sirius.official",
  "platform": "Android",
  "unityVersion": "6000.3.12f1",
  "extractionShards": 32,
  "r2Bucket": "hotdori-assets",
  "releaseRetention": 3,
  "authorizationRequired": true,
  "skipPublicResolutionCheck": true,
  "remoteRoot": "https://l14-prod-hk-patch-sirius.gamerfusiontech.com/prod/hk_27f3c91e8b62d6056c7a19f2e83b6d10/asset/Android",
  "masterRemoteRoot": "https://l14-prod-hk-patch-sirius.gamerfusiontech.com/prod/hk_27f3c91e8b62d6056c7a19f2e83b6d10/master",
  "criHcaKey": "8594927479",
  "masterCrypto": {
    "salt": "b50b23a5fd628c3dc386f7488f81d6b0450b8c89671574f55a3ad815f10b8e30",
    "key": "0532791c510a08eb7ede6b46c6ba71ea9aa2a3cfb678a595f89d67c8a5e493b6",
    "iv": "9b94c91e242a562e97fcd505b75a5129b2b80632a269034cf942ec7293d489a1"
  },
  "catalog": {
    "version": "1.0.0.100",
    "locales": ["ja", "en", "zh-Hant", "zh-Hans", "ko"]
  },
  "masterVersionEndpoint": "https://l14-prod-hk-all-gs-sirius.gamerfusiontech.com/app.masterdata.MasterdataService/Version"
}
